{
  "$schema": "./schemas/capabilities-1.0.json",
  "directives": {
    "kite-scope": {
      "syntax": "kite-scope=\"{ key: value, ... }\"",
      "purpose": "Creates an isolated or inherited reactive state scope on a DOM element using native JavaScript Proxy.",
      "example": "<div kite-scope=\"{ count: 0 }\">...</div>",
      "since": "1.0.0"
    },
    "kite-text": {
      "syntax": "kite-text=\"expression\"",
      "purpose": "Sets the textContent of the element, automatically evaluating expressions and strictly HTML-escaping text.",
      "example": "<span kite-text=\"user.name\"></span>",
      "since": "1.0.0"
    },
    "kite-html": {
      "syntax": "kite-html=\"expression\"",
      "purpose": "Sets the innerHTML of the element using the built-in sanitizer to prevent XSS injection.",
      "example": "<div kite-html=\"post.body\"></div>",
      "since": "1.0.0"
    },
    "kite-bind": {
      "syntax": "kite-bind:attribute=\"expression\"",
      "purpose": "Dynamically binds an HTML attribute or boolean property to an evaluated expression.",
      "example": "<input kite-bind:disabled=\"loading\" kite-bind:placeholder=\"placeholderText\">",
      "since": "1.0.0"
    },
    "kite-model": {
      "syntax": "kite-model=\"property\"",
      "purpose": "Enables two-way data binding on inputs, textareas, checkboxes, radio buttons, and selects.",
      "example": "<input type=\"text\" kite-model=\"username\">",
      "since": "1.0.0"
    },
    "kite-for": {
      "syntax": "kite-for=\"item in items [where filterExpr]\"",
      "purpose": "Renders repeated elements dynamically over arrays, objects, or number ranges.",
      "example": "<li kite-for=\"item in items where item.active\"><span kite-text=\"item.name\"></span></li>",
      "since": "1.0.0"
    },
    "kite-if": {
      "syntax": "kite-if=\"expression\"",
      "purpose": "Conditionally renders element into DOM if expression evaluates to truthy.",
      "example": "<div kite-if=\"isLoggedIn\">Welcome back!</div>",
      "related": ["kite-elif", "kite-else"],
      "since": "1.0.0"
    },
    "kite-elif": {
      "syntax": "kite-elif=\"expression\"",
      "purpose": "Alternative conditional branch following kite-if.",
      "example": "<div kite-elif=\"isGuest\">Browsing as guest</div>",
      "related": ["kite-if", "kite-else"],
      "since": "1.0.0"
    },
    "kite-else": {
      "syntax": "kite-else",
      "purpose": "Default fallback branch following kite-if or kite-elif.",
      "example": "<div kite-else>Please sign in</div>",
      "related": ["kite-if", "kite-elif"],
      "since": "1.0.0"
    },
    "kite-show": {
      "syntax": "kite-show=\"expression\"",
      "purpose": "Toggles element visibility via CSS display: none without removing it from the DOM tree.",
      "example": "<div kite-show=\"isOpen\">Modal content</div>",
      "since": "1.0.0"
    },
    "kite-on": {
      "syntax": "kite-on-event[.modifiers]=\"expression\"",
      "purpose": "Attaches event listeners with support for modifiers (prevent, stop, once, enter, escape, debounce, throttle).",
      "example": "<button kite-on-click.prevent=\"submit()\">Submit</button>",
      "modifiers": ["prevent", "stop", "once", "self", "enter", "escape", "space", "tab", "delete", "backspace", "up", "down", "left", "right", "debounce", "throttle"],
      "since": "1.0.0"
    },
    "kite-class": {
      "syntax": "kite-class:className=\"expression\"",
      "purpose": "Toggles a specific CSS class when the expression evaluates to truthy.",
      "example": "<div kite-class:active=\"isActive\" kite-class:is-loading=\"loading\">...</div>",
      "since": "1.0.0"
    },
    "kite-style": {
      "syntax": "kite-style:cssProperty=\"expression\"",
      "purpose": "Dynamically sets inline style properties.",
      "example": "<div kite-style:color=\"textColor\" kite-style:opacity=\"progress\">...</div>",
      "since": "1.0.0"
    },
    "kite-reset": {
      "syntax": "kite-reset",
      "purpose": "Restores reactive scope state back to its initial initialized values on click.",
      "example": "<button kite-reset>Reset Form</button>",
      "since": "1.0.0"
    },
    "kite-cloak": {
      "syntax": "kite-cloak",
      "purpose": "Hides uncompiled elements until Kite runtime finishes scanning to eliminate Flash of Unstyled Content (FOUC).",
      "example": "<body kite-cloak>...</body>",
      "since": "1.0.0"
    },
    "kite-skip": {
      "syntax": "kite-skip",
      "purpose": "Instructs the Kite scanner to skip compiling the element and all of its descendants.",
      "example": "<pre kite-skip><code>{{ raw_template }}</code></pre>",
      "since": "1.0.0"
    },
    "kite-persist": {
      "syntax": "kite-persist=\"storageKey\" [kite-persist:session] [kite-persist:fields=\"a,b\"]",
      "purpose": "Syncs reactive scope state with localStorage or sessionStorage automatically.",
      "example": "<div kite-scope=\"{ theme: 'dark' }\" kite-persist=\"user-prefs\">...</div>",
      "since": "1.0.0"
    },
    "kite-validate": {
      "syntax": "kite-validate=\"rule1|rule2:param\"",
      "purpose": "Validates form fields with built-in or custom rules and publishes field errors.",
      "example": "<input kite-model=\"email\" kite-validate=\"required|email\">",
      "since": "1.0.0"
    },
    "kite-emit": {
      "syntax": "kite-emit:eventName=\"expression\"",
      "purpose": "Dispatches a custom DOM event on the element when the expression triggers.",
      "example": "<button kite-on-click=\"save()\" kite-emit:saved=\"item\">Save</button>",
      "since": "1.0.0"
    },
    "kite-copy": {
      "syntax": "kite-copy=\"expression\"",
      "purpose": "Copies the evaluated text expression into the user clipboard on click.",
      "example": "<button kite-copy=\"shareUrl\">Copy Link</button>",
      "since": "1.0.0"
    },
    "kite-poll": {
      "syntax": "kite-poll.5s=\"fetchUpdates()\"",
      "purpose": "Executes expression repeatedly at a specified time interval.",
      "example": "<div kite-poll.30s=\"refreshData()\">...</div>",
      "since": "1.0.0"
    },
    "kite-shortcut": {
      "syntax": "kite-shortcut.ctrl-k=\"openSearch()\"",
      "purpose": "Binds a global keyboard shortcut to evaluate an expression.",
      "example": "<input kite-shortcut.escape=\"closeModal()\">",
      "since": "1.0.0"
    },
    "kite-watch": {
      "syntax": "kite-watch:prop=\"handler()\"",
      "purpose": "Observes specific property mutations and executes a callback.",
      "example": "<div kite-watch:query=\"onQueryChange()\">...</div>",
      "since": "1.0.0"
    },
    "kite-init": {
      "syntax": "kite-init=\"expression\"",
      "purpose": "Runs expression immediately once when the element is bound.",
      "example": "<div kite-init=\"loadUsers()\">...</div>",
      "since": "1.0.0"
    },
    "kite-computed": {
      "syntax": "kite-computed:prop=\"expression\" or kite-computed=\"{ prop: 'expr' }\"",
      "purpose": "Calculates and maintains reactive derived state values on the scope.",
      "example": "<div kite-computed:double=\"count * 2\">...</div>",
      "since": "1.0.0"
    },
    "kite-format": {
      "syntax": "kite-format=\"date|number|currency\"",
      "purpose": "Formats text contents of an element as date, formatted number, or currency.",
      "example": "<span kite-text=\"price\" kite-format=\"currency\"></span>",
      "since": "1.0.0"
    }
  },
  "tags": {
    "kite-component": {
      "purpose": "Defines a reusable template component with isolated scope, props, and slots.",
      "attributes": ["name", "props"],
      "example": "<kite-component name=\"modal-dialog\"><template>...</template></kite-component>",
      "since": "1.0.0"
    },
    "kite-use": {
      "purpose": "Instantiates a declared component, passing props and slot projections.",
      "attributes": ["name"],
      "example": "<kite-use name=\"modal-dialog\" title=\"Settings\"><p>Body text</p></kite-use>",
      "since": "1.0.0"
    },
    "slot": {
      "purpose": "Defines default or named content injection targets inside a <kite-component> template.",
      "attributes": ["name"],
      "example": "<slot></slot> or <slot name=\"actions\"></slot>",
      "since": "1.0.0"
    },
    "kite-model": {
      "purpose": "Defines a named global reactive data model with initial state, methods, and optional API adapter bindings.",
      "attributes": ["name", "api", "kite-persist"],
      "example": "<kite-model name=\"todos\">{ items: [], add(t) { this.items.push(t); } }</kite-model>",
      "since": "1.0.0"
    },
    "kite-view": {
      "purpose": "Binds a DOM subtree to a named model scope or serves as a routable template target.",
      "attributes": ["name", "model"],
      "example": "<div kite-view=\"todos-view\" model=\"todos\">...</div>",
      "since": "1.0.0"
    },
    "kite-controller": {
      "purpose": "Encapsulates named event action handlers for a model directly in HTML.",
      "attributes": ["name", "model"],
      "example": "<kite-controller name=\"todos-ctrl\" model=\"todos\"><kite-action name=\"clear\">...</kite-action></kite-controller>",
      "since": "1.0.0"
    },
    "kite-route": {
      "purpose": "Declares client-side hash routing rules mapping URL hash paths to view templates.",
      "attributes": ["path", "view"],
      "example": "<kite-route path=\"/dashboard\" view=\"dashboard-view\"></kite-route>",
      "since": "1.0.0"
    },
    "kite-outlet": {
      "purpose": "DOM container where currently active route views are mounted.",
      "attributes": [],
      "example": "<kite-outlet></kite-outlet>",
      "since": "1.0.0"
    },
    "kite-api": {
      "purpose": "Declarative REST/fetch client definition with base URL and default headers.",
      "attributes": ["name", "base", "adapter"],
      "example": "<kite-api name=\"products-api\" base=\"/api/v1/products\"></kite-api>",
      "since": "1.0.0"
    },
    "kite-store": {